{
  "id": "landmine",
  "name": {
    "zh-CN": "地雷架底座",
    "en": "Landmine attachment"
  },
  "aliases": [
    "地雷架底座",
    "Landmine attachment",
    "landmine"
  ],
  "category": "support",
  "patterns": [
    "support"
  ],
  "regions": [
    "not-applicable"
  ],
  "settings": [
    "home",
    "gym"
  ],
  "role": "support",
  "path": "support",
  "learning": "low",
  "footprint": "medium",
  "use": {
    "zh-CN": "限制杠铃一端的转轴",
    "en": "Anchors one end of a barbell"
  },
  "caution": {
    "zh-CN": "需兼容杠铃及稳固固定",
    "en": "Requires a compatible bar and secure anchor"
  },
  "sources": [
    "lf-catalog",
    "tg-catalog"
  ],
  "evidenceScope": {
    "zh-CN": "厂商目录仅用于识别类别。配件安全与承重须逐型号查手册；没有“增肌效果”分数。",
    "en": "Manufacturer catalogs identify categories only. Check each model manual for ratings and safe use; no hypertrophy score is assigned."
  },
  "reviewStatus": "editorial-classification; model-specific review pending",
  "image": "support.svg",
  "alternatives": []
}
