{
  "id": "massage-ball",
  "name": {
    "zh-CN": "筋膜按摩球",
    "en": "Massage ball"
  },
  "aliases": [
    "筋膜按摩球",
    "Massage ball",
    "massage-ball"
  ],
  "category": "recovery",
  "patterns": [
    "mobility"
  ],
  "regions": [
    "varies"
  ],
  "settings": [
    "home",
    "gym"
  ],
  "role": "recovery",
  "path": "support",
  "learning": "low",
  "footprint": "small",
  "use": {
    "zh-CN": "小范围局部施压",
    "en": "Local pressure over a small area"
  },
  "caution": {
    "zh-CN": "避开急性损伤、骨突与神经血管区",
    "en": "Avoid acute injuries, bony points and neurovascular areas"
  },
  "sources": [
    "foam-2019",
    "stretching-2011"
  ],
  "evidenceScope": {
    "zh-CN": "恢复文献只支持相应干预，不可把泡沫轴证据迁移成筋膜枪、按摩球或其他设备的有效性证明。",
    "en": "Recovery evidence applies to the studied interventions. Foam-rolling evidence does not validate percussion guns or other devices."
  },
  "reviewStatus": "editorial-classification; model-specific review pending",
  "image": "recovery.svg",
  "alternatives": []
}
