{
  "id": "battle-ropes",
  "name": {
    "zh-CN": "战绳",
    "en": "Battle ropes"
  },
  "aliases": [
    "战绳",
    "Battle ropes",
    "battle-ropes"
  ],
  "category": "conditioning",
  "patterns": [
    "multi"
  ],
  "regions": [
    "varies"
  ],
  "settings": [
    "home",
    "gym",
    "outdoor"
  ],
  "role": "conditioning",
  "path": "self",
  "learning": "moderate",
  "footprint": "large",
  "use": {
    "zh-CN": "产生重复波动的体能动作",
    "en": "Repeated waves for conditioning"
  },
  "caution": {
    "zh-CN": "固定锚点，留出绳索运动区",
    "en": "Secure the anchor and clear the rope area"
  },
  "sources": [
    "who-2020",
    "cdc-activity"
  ],
  "evidenceScope": {
    "zh-CN": "来源支持训练类别，不是本型号的直接比较试验；结构描述为编辑归纳，具体使用以厂商手册为准。",
    "en": "Sources support the training class, not a direct trial of this device. Mechanical descriptions are editorial; consult the model manual."
  },
  "reviewStatus": "editorial-classification; model-specific review pending",
  "image": "conditioning.svg",
  "alternatives": [
    "punching-bag"
  ]
}
