{
  "id": "seated-calf",
  "name": {
    "zh-CN": "坐姿提踵机",
    "en": "Seated calf raise machine"
  },
  "aliases": [
    "坐姿提踵机",
    "Seated calf raise machine",
    "seated-calf"
  ],
  "category": "plate",
  "patterns": [
    "calf"
  ],
  "regions": [
    "calves"
  ],
  "settings": [
    "gym"
  ],
  "role": "resistance",
  "path": "guided",
  "learning": "moderate",
  "footprint": "large",
  "use": {
    "zh-CN": "屈膝位提踵",
    "en": "Calf raise with knees flexed"
  },
  "caution": {
    "zh-CN": "先熟悉解锁与回架",
    "en": "Learn the release and re-rack"
  },
  "sources": [
    "acsm-2026",
    "machines-2023"
  ],
  "evidenceScope": {
    "zh-CN": "来源支持训练类别，不是本型号的直接比较试验；结构描述为编辑归纳，具体使用以厂商手册为准。",
    "en": "Sources support the training class, not a direct trial of this device. Mechanical descriptions are editorial; consult the model manual."
  },
  "reviewStatus": "editorial-classification; model-specific review pending",
  "image": "plate.svg",
  "alternatives": [
    "standing-calf"
  ]
}
