{
  "id": "hurdles",
  "name": {
    "zh-CN": "训练跨栏",
    "en": "Training hurdles"
  },
  "aliases": [
    "训练跨栏",
    "Training hurdles",
    "hurdles"
  ],
  "category": "conditioning",
  "patterns": [
    "jump"
  ],
  "regions": [
    "legs"
  ],
  "settings": [
    "home",
    "gym"
  ],
  "role": "conditioning",
  "path": "self",
  "learning": "moderate",
  "footprint": "medium",
  "use": {
    "zh-CN": "跨步或跳跃路线",
    "en": "Stepping or jumping routes"
  },
  "caution": {
    "zh-CN": "适当高度与无障碍落地区",
    "en": "Use suitable height and a clear landing zone"
  },
  "sources": [
    "who-2020",
    "cdc-activity"
  ],
  "evidenceScope": {
    "zh-CN": "来源支持训练类别，不是本型号的直接比较试验；结构描述为编辑归纳，具体使用以厂商手册为准。",
    "en": "Sources support the training class, not a direct trial of this device. Mechanical descriptions are editorial; consult the model manual."
  },
  "reviewStatus": "editorial-classification; model-specific review pending",
  "image": "conditioning.svg",
  "alternatives": [
    "jump-rope",
    "plyo-box",
    "rebounder"
  ]
}
