{
  "id": "massage-gun",
  "name": {
    "zh-CN": "筋膜枪",
    "en": "Percussion massager"
  },
  "aliases": [
    "筋膜枪",
    "Percussion massager",
    "massage-gun"
  ],
  "category": "recovery",
  "patterns": [
    "mobility"
  ],
  "regions": [
    "varies"
  ],
  "settings": [
    "home",
    "gym"
  ],
  "role": "recovery",
  "path": "support",
  "learning": "moderate",
  "footprint": "small",
  "use": {
    "zh-CN": "短时局部振动辅助",
    "en": "Short local percussion aid"
  },
  "caution": {
    "zh-CN": "不用于伤口、疑似血栓或颈前部",
    "en": "Not over wounds, suspected clots or the front of the neck"
  },
  "sources": [
    "foam-2019",
    "stretching-2011"
  ],
  "evidenceScope": {
    "zh-CN": "恢复文献只支持相应干预，不可把泡沫轴证据迁移成筋膜枪、按摩球或其他设备的有效性证明。",
    "en": "Recovery evidence applies to the studied interventions. Foam-rolling evidence does not validate percussion guns or other devices."
  },
  "reviewStatus": "editorial-classification; model-specific review pending",
  "image": "recovery.svg",
  "alternatives": []
}
