{
  "id": "grip-dynamometer",
  "name": {
    "zh-CN": "握力计",
    "en": "Grip dynamometer"
  },
  "aliases": [
    "握力计",
    "Grip dynamometer",
    "grip-dynamometer"
  ],
  "category": "measurement",
  "patterns": [
    "measure"
  ],
  "regions": [
    "not-applicable"
  ],
  "settings": [
    "home",
    "gym"
  ],
  "role": "measurement",
  "path": "measurement",
  "learning": "low",
  "footprint": "pocket",
  "use": {
    "zh-CN": "标准姿态下测抓握表现",
    "en": "Measures grip in a standardized position"
  },
  "caution": {
    "zh-CN": "不同姿势与型号不可直接比较",
    "en": "Positions and devices are not automatically comparable"
  },
  "sources": [
    "bia-2021",
    "resistance-obesity"
  ],
  "evidenceScope": {
    "zh-CN": "前者为特定体脂秤验证，后者说明结局指标区分；不构成所有监测设备的精度验证。",
    "en": "One validates specific BIA scales; the other distinguishes body-composition outcomes. These do not validate all monitors."
  },
  "reviewStatus": "editorial-classification; model-specific review pending",
  "image": "measurement.svg",
  "alternatives": []
}
