{
  "id": "cable-handles",
  "name": {
    "zh-CN": "滑轮握把附件",
    "en": "Cable attachments"
  },
  "aliases": [
    "滑轮握把附件",
    "Cable attachments",
    "cable-handles"
  ],
  "category": "support",
  "patterns": [
    "support"
  ],
  "regions": [
    "not-applicable"
  ],
  "settings": [
    "home",
    "gym"
  ],
  "role": "support",
  "path": "support",
  "learning": "low",
  "footprint": "small",
  "use": {
    "zh-CN": "改变握距与连接方式",
    "en": "Changes grip spacing and attachment"
  },
  "caution": {
    "zh-CN": "附件本身不产生阻力",
    "en": "Attachments do not supply resistance alone"
  },
  "sources": [
    "lf-catalog",
    "tg-catalog"
  ],
  "evidenceScope": {
    "zh-CN": "厂商目录仅用于识别类别。配件安全与承重须逐型号查手册；没有“增肌效果”分数。",
    "en": "Manufacturer catalogs identify categories only. Check each model manual for ratings and safe use; no hypertrophy score is assigned."
  },
  "reviewStatus": "editorial-classification; model-specific review pending",
  "image": "support.svg",
  "alternatives": []
}
