{
  "id": "recumbent-bike",
  "name": {
    "zh-CN": "卧式健身车",
    "en": "Recumbent bike"
  },
  "aliases": [
    "卧式健身车",
    "Recumbent bike",
    "recumbent-bike"
  ],
  "category": "cardio",
  "patterns": [
    "cycle"
  ],
  "regions": [
    "legs"
  ],
  "settings": [
    "home",
    "gym"
  ],
  "role": "aerobic",
  "path": "cyclic",
  "learning": "low",
  "footprint": "large",
  "use": {
    "zh-CN": "靠背支持的周期踩踏",
    "en": "Back-supported cycling"
  },
  "caution": {
    "zh-CN": "低冲击不代表适合每种膝痛",
    "en": "Low impact does not mean suitable for every knee condition"
  },
  "sources": [
    "who-2020",
    "cdc-activity"
  ],
  "evidenceScope": {
    "zh-CN": "来源支持训练类别，不是本型号的直接比较试验；结构描述为编辑归纳，具体使用以厂商手册为准。",
    "en": "Sources support the training class, not a direct trial of this device. Mechanical descriptions are editorial; consult the model manual."
  },
  "reviewStatus": "editorial-classification; model-specific review pending",
  "image": "cardio.svg",
  "alternatives": [
    "upright-bike",
    "spin-bike",
    "air-bike"
  ]
}
